[
  {"id":"apply_condiment","node_type":"TaskTemplate","name_en":"Apply condiment to food","name_ja":"食品に調味料をかける","verb":"apply","roles":{"theme":"condiment","container":"dispensing_container","target":"food"},"compatible_scenes":["scene_dining_table","scene_home_kitchen","scene_restaurant_table","scene_restaurant_kitchen"],"preconditions":["contains(container, theme)","open(container)","near(container, target)"],"goals":["on_top_of(theme, target)","safe(container)"],"skills":["skill_grasp","skill_open","skill_orient","skill_squeeze","skill_dispense","skill_close"],"failure_modes":["spill","over_dispense","drop_container","dispense_off_target"],"safety_tags":["food_handling","spill_risk"],"review_status":"proposed"},
  {"id":"handover_object","node_type":"TaskTemplate","name_en":"Hand an object to another agent","name_ja":"物体を人へ手渡す","verb":"handover","roles":{"theme":"handover_object","recipient":"person"},"compatible_scenes":["scene_dining_table","scene_home_kitchen","scene_restaurant_table","scene_kitchen_counter"],"preconditions":["reachable(theme)","recipient_present","safe_grasp(theme)"],"goals":["held_by(theme, recipient)","theme_released_by(robot)"],"skills":["skill_locate","skill_approach","skill_grasp","skill_handover","skill_release"],"failure_modes":["drop_object","recipient_not_ready","collision_with_hand"],"safety_tags":["human_proximity","handover"],"review_status":"proposed"},
  {"id":"store_in_cold_storage","node_type":"TaskTemplate","name_en":"Store an object in cold storage","name_ja":"物体を冷蔵庫へ収納する","verb":"store","roles":{"theme":"refrigerated_object","destination":"refrigerator"},"compatible_scenes":["scene_dining_table","scene_home_kitchen","scene_kitchen_counter","scene_refrigerator"],"preconditions":["reachable(theme)","closed(theme)","closed(destination)"],"goals":["inside(theme, destination)","upright(theme)","closed(destination)"],"skills":["skill_locate","skill_approach","skill_grasp","skill_lift","skill_navigate_or_reach","skill_open","skill_place","skill_release","skill_close","skill_verify"],"failure_modes":["drop_object","place_horizontally","leave_door_open","shelf_collision","wrong_receptacle"],"safety_tags":["cold_storage","door_collision"],"review_status":"proposed"},
  {"id":"retrieve_from_storage","node_type":"TaskTemplate","name_en":"Retrieve an object from storage","name_ja":"収納場所から物体を取り出す","verb":"retrieve","roles":{"theme":"stored_object","source":"storage"},"compatible_scenes":["scene_refrigerator","scene_pantry","scene_home_kitchen"],"preconditions":["inside(theme, source)","reachable(source)"],"goals":["held_by(theme, robot)","outside(theme, source)","close(source)"],"skills":["skill_locate","skill_open","skill_reach","skill_grasp","skill_lift","skill_close","skill_verify"],"failure_modes":["occluded_object","drop_object","door_left_open","collision_with_shelf"],"safety_tags":["storage_access","door_collision"],"review_status":"proposed"},
  {"id":"transport_object","node_type":"TaskTemplate","name_en":"Transport an object between surfaces","name_ja":"物体を別の場所へ運ぶ","verb":"transport","roles":{"theme":"portable_object","source":"source_surface","destination":"target_surface"},"compatible_scenes":["scene_home_kitchen","scene_dining_table","scene_kitchen_counter","scene_restaurant_kitchen","scene_restaurant_table"],"preconditions":["on_top_of(theme, source)","reachable(theme)","reachable(destination)"],"goals":["on_top_of(theme, destination)","stable(theme)"],"skills":["skill_locate","skill_approach","skill_grasp","skill_lift","skill_navigate_or_reach","skill_place","skill_release","skill_verify"],"failure_modes":["drop_object","collision","wrong_destination","unstable_placement"],"safety_tags":["transport"],"review_status":"proposed"},
  {"id":"right_object","node_type":"TaskTemplate","name_en":"Right a fallen object","name_ja":"倒れた物体を起こす","verb":"right","roles":{"theme":"fallen_object","support":"support_surface"},"compatible_scenes":["scene_home_kitchen","scene_dining_table","scene_kitchen_counter","scene_supermarket_shelf"],"preconditions":["fallen(theme)","reachable(theme)"],"goals":["upright(theme)","stable(theme)"],"skills":["skill_locate","skill_approach","skill_grasp","skill_recover","skill_place","skill_verify"],"failure_modes":["push_object_off_surface","grasp_cap","tip_again"],"safety_tags":["recovery"],"review_status":"proposed"},
  {"id":"close_container","node_type":"TaskTemplate","name_en":"Close a container","name_ja":"容器を閉める","verb":"close","roles":{"theme":"container","part":"closure"},"compatible_scenes":["scene_home_kitchen","scene_dining_table","scene_restaurant_kitchen","scene_restaurant_table"],"preconditions":["open(theme)","closure_attached(part)"],"goals":["closed(theme)","not_leaking(theme)"],"skills":["skill_grasp","skill_close","skill_verify"],"failure_modes":["cross_thread","incomplete_close","squeeze_contents"],"safety_tags":["food_handling","leak_prevention"],"review_status":"proposed"},
  {"id":"open_container","node_type":"TaskTemplate","name_en":"Open a container","name_ja":"容器を開ける","verb":"open","roles":{"theme":"container","part":"closure"},"compatible_scenes":["scene_home_kitchen","scene_dining_table","scene_restaurant_kitchen","scene_restaurant_table"],"preconditions":["closed(theme)","reachable(theme)"],"goals":["open(theme)","closure_retained(part)"],"skills":["skill_grasp","skill_open","skill_verify"],"failure_modes":["drop_cap","grasp_body_unstably","spill_contents"],"safety_tags":["food_handling","spill_risk"],"review_status":"proposed"},
  {"id":"inspect_container_state","node_type":"TaskTemplate","name_en":"Inspect container state","name_ja":"容器の状態を確認する","verb":"inspect","roles":{"theme":"container","property":"state_property"},"compatible_scenes":["scene_home_kitchen","scene_dining_table","scene_refrigerator","scene_pantry","scene_supermarket_shelf","scene_checkout_counter"],"preconditions":["visible(theme)"],"goals":["property_recorded(theme)","safe_to_continue(theme)"],"skills":["skill_locate","skill_inspect","skill_verify"],"failure_modes":["misread_level","occlusion","unsafe_contact"],"safety_tags":["inspection"],"review_status":"proposed"},
  {"id":"discard_container","node_type":"TaskTemplate","name_en":"Discard an empty container","name_ja":"空の容器を廃棄する","verb":"discard","roles":{"theme":"empty_container","destination":"waste_receptacle"},"compatible_scenes":["scene_home_kitchen","scene_trash_sorting_area","scene_restaurant_kitchen"],"preconditions":["empty(theme)","reachable(theme)","destination_available"],"goals":["inside(theme, destination)","safe(theme)"],"skills":["skill_locate","skill_grasp","skill_lift","skill_place","skill_release","skill_verify"],"failure_modes":["discard_nonempty_container","wrong_waste_stream","drop_object"],"safety_tags":["waste","sorting"],"review_status":"proposed"},
  {"id":"separate_container_parts","node_type":"TaskTemplate","name_en":"Separate container parts","name_ja":"容器の部品を分ける","verb":"separate","roles":{"theme":"container","part":"detachable_part"},"compatible_scenes":["scene_home_kitchen","scene_trash_sorting_area"],"preconditions":["detachable(theme, part)","empty(theme)"],"goals":["separated(theme, part)","parts_ready_for_sorting"],"skills":["skill_grasp","skill_open","skill_separate","skill_sort","skill_verify"],"failure_modes":["break_part","leave_residue","sort_wrongly"],"safety_tags":["waste","small_parts"],"review_status":"proposed"},
  {"id":"restock_shelf","node_type":"TaskTemplate","name_en":"Restock a product shelf","name_ja":"商品棚へ補充する","verb":"restock","roles":{"theme":"retail_product","destination":"display_shelf"},"compatible_scenes":["scene_supermarket_shelf","scene_restaurant_kitchen","scene_pantry"],"preconditions":["reachable(theme)","display_space_available"],"goals":["on_shelf(theme, destination)","stable(theme)"],"skills":["skill_locate","skill_grasp","skill_lift","skill_place","skill_release","skill_align","skill_verify"],"failure_modes":["falling_product","wrong_shelf","blocked_label","collision_with_customer"],"safety_tags":["retail","human_proximity"],"review_status":"proposed"},
  {"id":"align_display_item","node_type":"TaskTemplate","name_en":"Face an item on display","name_ja":"商品を正面に揃える","verb":"align","roles":{"theme":"display_item","destination":"display_shelf"},"compatible_scenes":["scene_supermarket_shelf","scene_checkout_counter","scene_dining_table"],"preconditions":["on_shelf(theme, destination)","reachable(theme)"],"goals":["label_front(theme)","stable(theme)"],"skills":["skill_locate","skill_grasp","skill_orient","skill_align","skill_release","skill_verify"],"failure_modes":["knock_adjacent_item","wrong_orientation","drop_item"],"safety_tags":["retail","display"],"review_status":"proposed"},
  {"id":"place_in_receptacle","node_type":"TaskTemplate","name_en":"Place an item in a receptacle","name_ja":"物体を入れ物へ入れる","verb":"place","roles":{"theme":"portable_item","destination":"receptacle"},"compatible_scenes":["scene_shopping_cart","scene_trash_sorting_area","scene_home_kitchen","scene_pantry"],"preconditions":["reachable(theme)","open(destination)"],"goals":["inside(theme, destination)","stable(theme)"],"skills":["skill_grasp","skill_lift","skill_place","skill_release","skill_verify"],"failure_modes":["miss_receptacle","damage_contents","wrong_receptacle"],"safety_tags":["receptacle"],"review_status":"proposed"},